<?xml version="1.0" encoding="ISO-8859-1"?>
<!DOCTYPE grammaire SYSTEM "grammaire.dtd">
<?xml-stylesheet type="text/xsl" href="grammaire.xsl" ?>
<grammaire>
	<regle>
		<gauche>Phrase</gauche>
		<pd>
			<selection>2</selection>
			<corps>Sujet Gv .</corps>
		</pd>
		<pd>
			<selection>3</selection>
			<corps>Sujet Gv . Phrase</corps>
		</pd>
	</regle>
	<regle>
		<gauche>Gn</gauche>
		<pd>
			<selection>1</selection>
			<corps>Art Sa Nom Sa Relative</corps>
		</pd>
	</regle>
	<regle>
		<gauche>Sujet</gauche>
		<pd>
			<selection>1</selection>
			<corps>Art Sa Nom Sa Incise</corps>
		</pd>
	</regle>
	<regle>
		<gauche>Art</gauche>
		<pd>
			<selection>1</selection>
			<corps>le</corps>
		</pd>
		<pd>
			<selection>2</selection>
			<corps>un</corps>
		</pd>
	</regle>
	<regle>
		<gauche>Sa</gauche>
		<pd>
			<selection>1</selection>
			<corps>Adjectif</corps>
		</pd>
		<pd>
			<selection>2</selection>
			<corps>vide</corps>
		</pd>
	</regle>
	<regle>
		<gauche>Nom</gauche>
		<pd>
			<selection>1</selection>
			<corps>stagiaire</corps>
		</pd>
		<pd>
			<selection>1</selection>
			<corps>dentiste</corps>
		</pd>
		<pd>
			<selection>1</selection>
			<corps>professeur</corps>
		</pd>
		<pd>
			<selection>1</selection>
			<corps>clavier</corps>
		</pd>
	</regle>
	<regle>
		<gauche>Adjectif</gauche>
		<pd>
			<selection>1</selection>
			<corps>taquin</corps>
		</pd>
		<pd>
			<selection>1</selection>
			<corps>sérieux</corps>
		</pd>
		<pd>
			<selection>1</selection>
			<corps>misérable</corps>
		</pd>
		<pd>
			<selection>1</selection>
			<corps>farfelu</corps>
		</pd>
	</regle>
	<regle>
		<gauche>Gv</gauche>
		<pd>
			<selection>1</selection>
			<corps>VerbeIntransitif Sadv</corps>
		</pd>
		<pd>
			<selection>1</selection>
			<corps>VerbeTransitif Sadv Gn</corps>
		</pd>
	</regle>
	<regle>
		<gauche>VerbeIntransitif</gauche>
		<pd>
			<selection>1</selection>
			<corps>joue</corps>
		</pd>
		<pd>
			<selection>1</selection>
			<corps>crie</corps>
		</pd>
		<pd>
			<selection>1</selection>
			<corps>apprécie</corps>
		</pd>
	</regle>
	<regle>
		<gauche>VerbeIntransitif1</gauche>
		<pd>
			<selection>1</selection>
			<corps>joue</corps>
		</pd>
		<pd>
			<selection>1</selection>
			<corps>se régale</corps>
		</pd>
		<pd>
			<selection>1</selection>
			<corps>se sert</corps>
		</pd>
	</regle>
	<regle>
		<gauche>VerbeTransitif</gauche>
		<pd>
			<selection>1</selection>
			<corps>aime</corps>
		</pd>
		<pd>
			<selection>1</selection>
			<corps>mord</corps>
		</pd>
		<pd>
			<selection>1</selection>
			<corps>apprécie</corps>
		</pd>
	</regle>
	<regle>
		<gauche>Sadv</gauche>
		<pd>
			<selection>1</selection>
			<corps>Adverbe</corps>
		</pd>
		<pd>
			<selection>2</selection>
			<corps>vide</corps>
		</pd>
	</regle>
	<regle>
		<gauche>Adverbe</gauche>
		<pd>
			<selection>1</selection>
			<corps>furieusement</corps>
		</pd>
		<pd>
			<selection>1</selection>
			<corps>mollement</corps>
		</pd>
		<pd>
			<selection>1</selection>
			<corps>paresseusement</corps>
		</pd>
	</regle>
	<regle>
		<gauche>Relative</gauche>
		<pd>
			<selection>2</selection>
			<corps>qui Gv</corps>
		</pd>
		<pd>
			<selection>1</selection>
			<corps>dont Gn VerbeIntransitif1 Sadv</corps>
		</pd>
		<pd>
			<selection>10</selection>
			<corps>vide</corps>
		</pd>
	</regle>
	<regle>
		<gauche>Incise</gauche>
		<pd>
			<selection>2</selection>
			<corps>, qui Gv ,</corps>
		</pd>
		<pd>
			<selection>1</selection>
			<corps>, alors qu'un Sa Nom Sa VerbeIntransitif Sadv ,</corps>
		</pd>
		<pd>
			<selection>1</selection>
			<corps>, alors que le Sa Nom Sa VerbeIntransitif Sadv ,</corps>
		</pd>
		<pd>
			<selection>10</selection>
			<corps>vide</corps>
		</pd>
	</regle>

</grammaire>